{
  "name": "Cylinder from Nightly",
  "description": "Cylinder template from Nightly build installation",
  "scope": "source.scad",
  "body": [
    "// Cylinder template from nightly build",
    "// Location: inst/OpenSCAD (Nightly)/templates/",
    "// Nightly build variation",
    "cylinder(",
    "  h=${1:10},",
    "  r=${2:5},",
    "  center=${3:false},",
    "  $fn=${4:50}",
    ");",
    "$0"
  ],
  "prefix": "cylinder_nightly"
}
